{
  "barba_cv_version": "1.2",
  "personal_info": {
    "first_name": "Giacomo",
    "middle_name": "",
    "last_name": "Tüfekçi",
    "date_of_birth": "1991",
    "address": {
      "street": "Sedanstr. 26",
      "postal_code": "67063",
      "city": "Ludwigshafen am Rhein",
      "country": "DE"
    },
    "contact": {
      "email": "giacomo@tuefekci.de",
      "phone": ""
    },
    "links": {
      "linkedin": "",
      "github": "https://github.com/tuefekci",
      "website": "https://giacomo.tuefekci.de",
      "twitter": ""
    }
  },
  "profile_summary": "I'm a Full-Stack Developer based in Ludwigshafen am Rhein, Germany, with a background in web development, software engineering, and game design. I enjoy building end-to-end solutions and working seamlessly across various programming languages and web frameworks. Beyond just writing code, I value strong project management to ensure ideas actually make it to production efficiently and on time. When I’m not at my keyboard, I’m usually tinkering with electronics, keeping up with new tech, or tending to my garden. I also enjoy winding down with gaming, anime, and web novels. I speak fluent German and English, and I always aim to bring a practical, creative approach to the software I build.",
  "position_sought": [
    "Web Developer",
    "Web Designer",
    "Software Developer",
    "Full-Stack Developer"
  ],
  "experiences": [
    {
      "organization": "Tüfekci Software Development & Consulting",
      "role_title": "Full Stack Software Developer",
      "location": {
        "city": "Bremen",
        "country": "DE"
      },
      "start_date": "2020-01-01",
      "end_date": "",
      "website": "",
      "logo": "",
      "tasks": [
        "Development of an Download Manager as a Prototype in PHP and than in Svelte",
        "Development of an Web Application for the Management of a Cleaning Company",
        "Development of an Web Application for the Management of an QR Code based Redirection System",
        "Development of Apps, Plugins, Wrappers and Apis for Deta.space",
        "Development of an Web Application which enables playing retro games in the Browser based on WASM Compiled Emulators.",
        "Development of an Android Application to read Web & Light Novels from different Providers in an unified UI.",
        "Development of an API & Crawler to build an index of Web & Light Novels from different Providers.",
        "Some Prototype ML/AI Applications which can generate Content, Images, Translate etc. which is used in different Projects."
      ],
      "achievements": []
    },
    {
      "organization": "",
      "role_title": "Cloud Development / Software Developer",
      "location": {
        "city": "",
        "country": "DE"
      },
      "start_date": "2018-03-01",
      "end_date": "2019-10-31",
      "website": "",
      "logo": "",
      "tasks": [
        "Development of an Network Bridge between Web/Cloud to VisualBasic Application",
        "Development of an Application/API to automate Facebook Events",
        "Development of an APP for the Android and iOS Platform for Room Booking"
      ],
      "achievements": []
    },
    {
      "organization": "RR Software GmbH",
      "role_title": "Productowner",
      "location": {
        "city": "Hasselfelde",
        "country": "DE"
      },
      "start_date": "2017-09-01",
      "end_date": "2018-02-28",
      "website": "",
      "logo": "",
      "tasks": [
        "Planned and ReDesigned a Cloud/Web based Management System"
      ],
      "achievements": []
    },
    {
      "organization": "planetmutlu gmbh & co. kg",
      "role_title": "Lead Web / Software Developer",
      "location": {
        "city": "Bremen",
        "country": "DE"
      },
      "start_date": "2015-07-01",
      "end_date": "2017-08-31",
      "website": "",
      "logo": "",
      "tasks": [
        "Managed a 5-person development team",
        "Planned, Developed and Managed a booking, website and web2print system for cinemas (pmkino) using PhalconPHP, Wordpress, MongoDB, Python, NodeJS and ReactJS",
        "Developed a Web2Print solution using PhalconPHP, Wordpress, MongoDB, Python, NodeJS and ReactJS",
        "Developed a Wordpress Plugin and Theme environment for Messe Bremen Events, which was used in 10+ Websites."
      ],
      "achievements": []
    },
    {
      "organization": "Tüfekci Software Development & Consulting",
      "role_title": "Freelance Full Stack Web Developer",
      "location": {
        "city": "Bremen",
        "country": "DE"
      },
      "start_date": "2014-06-01",
      "end_date": "2015-06-31",
      "website": "",
      "logo": "",
      "tasks": [],
      "achievements": []
    },
    {
      "organization": "Humburg Media Group (Druckhaus Humburg)",
      "role_title": "Lead IT Manager",
      "location": {
        "city": "Bremen",
        "country": "DE"
      },
      "start_date": "2013-08-01",
      "end_date": "2014-05-31",
      "website": "",
      "logo": "",
      "tasks": [
        "Managed a 4-person development team"
      ],
      "achievements": []
    },
    {
      "organization": "image advertising gmbh & co. kg",
      "role_title": "Apprenticeship Media Designer",
      "location": {
        "city": "Bremen",
        "country": "DE"
      },
      "start_date": "2010-08-01",
      "end_date": "2013-08-31",
      "website": "",
      "logo": "",
      "tasks": [],
      "achievements": []
    },
    {
      "organization": "SaveFM",
      "role_title": "CTO & Co Founder",
      "location": {
        "city": "Bremen",
        "country": "DE"
      },
      "start_date": "2010-01-01",
      "end_date": "2010-12-31",
      "website": "",
      "logo": "",
      "tasks": [],
      "achievements": []
    },
    {
      "organization": "Maritim Hotel Bremen",
      "role_title": "Apprenticeship Cook",
      "location": {
        "city": "Bremen",
        "country": "DE"
      },
      "start_date": "2009",
      "end_date": "2010-06-31",
      "website": "",
      "logo": "",
      "tasks": [],
      "achievements": []
    },
    {
      "organization": "Maritim Hotel Bremen",
      "role_title": "Parttime Line Cook / Service Staff",
      "location": {
        "city": "Bremen",
        "country": "DE"
      },
      "start_date": "2008",
      "end_date": "2009-09-31",
      "website": "",
      "logo": "",
      "tasks": [],
      "achievements": []
    },
    {
      "organization": "Tüfekci Software Development & Consulting",
      "role_title": "Freelance Web Developer",
      "location": {
        "city": "Bremen",
        "country": "DE"
      },
      "start_date": "2008-01-01",
      "end_date": "2010-08-31",
      "website": "",
      "logo": "",
      "tasks": [],
      "achievements": []
    },
    {
      "organization": "ASG Supermarket",
      "role_title": "Parttime Cashier and Stocker",
      "location": {
        "city": "Bremen",
        "country": "DE"
      },
      "start_date": "2007",
      "end_date": "2009",
      "website": "",
      "logo": "",
      "tasks": [],
      "achievements": []
    },
    {
      "organization": "GP (Getränke Partner)",
      "role_title": "Parttime Cashier and Stocker",
      "location": {
        "city": "Bremen",
        "country": "DE"
      },
      "start_date": "2007",
      "end_date": "2008",
      "website": "",
      "logo": "",
      "tasks": [],
      "achievements": []
    }
  ],
  "education": [
    {
      "school": "Wilhelm Wagenfeld-Schule",
      "degree": "journeyman's certificate, specialized in Design and Technology",
      "field": "Media Designer",
      "start_date": "2010-10-01",
      "end_date": "2013-06-01",
      "website": "",
      "logo": "",
      "school_location": {
        "city": "",
        "country": "DE"
      }
    },
    {
      "school": "SZ Rübekamp",
      "degree": "journeyman's certificate, early dropout due to allergic reactions.",
      "field": "Apprenticeship Cook",
      "start_date": "2009",
      "end_date": "2010",
      "website": "",
      "logo": "",
      "school_location": {
        "city": "",
        "country": "DE"
      }
    },
    {
      "school": "FOS Delmestrasse",
      "degree": "vocational baccalaureate (completed practical part)",
      "field": "Social Pedagogy",
      "start_date": "2008",
      "end_date": "2009",
      "website": "",
      "logo": "",
      "school_location": {
        "city": "",
        "country": "DE"
      }
    },
    {
      "school": "SZ Drebberstraße",
      "degree": "secondary school (certificate Real school)",
      "field": "Highschool",
      "start_date": "2002",
      "end_date": "2008",
      "website": "",
      "logo": "",
      "school_location": {
        "city": "",
        "country": "DE"
      }
    }
  ],
  "skills": {
    "it_skills": [
      {
        "name": "Web Development",
        "level": "Master",
        "category": "",
        "keywords": [
          "AJAX",
          "AMPHP",
          "Bootstrap",
          "CSS",
          "CSS3",
          "CakePHP",
          "Canvas",
          "Chai",
          "Composer",
          "Contao",
          "Drupal",
          "ES6+",
          "Ember.js",
          "Gulp",
          "HTML",
          "HTML5",
          "Handlebars",
          "JSON",
          "Javascript",
          "Joomla",
          "Laravel",
          "Less",
          "Magento",
          "MongoDB",
          "Mustache",
          "MySQL",
          "NoSQL",
          "NodeJS",
          "OOP",
          "PHP5",
          "PHP7",
          "PHP8",
          "PHPUnit",
          "PhalconPHP",
          "Preact",
          "Purecss",
          "REST",
          "React",
          "ReactPHP",
          "Responsive Design",
          "Sass",
          "Shopware",
          "Slim",
          "Solid",
          "Svelte",
          "SvelteKit",
          "TestCafe",
          "TypeScript",
          "Typo3",
          "Vite",